{
  "schema_version": "1.0.0",
  "release_id": "homologacao-1234567890abcdef1234567890abcdef",
  "environment": "homologacao",
  "result": "PENDING",
  "state": "CREATED",
  "started_at": "2026-07-26T12:00:00.000Z",
  "finished_at": null,
  "operator": "tel-admin",
  "git_repository": "https://github.com/institutobrana/branacloud.git",
  "git_branch": "release/homologacao",
  "git_commit": "0123456789abcdef0123456789abcdef01234567",
  "git_commit_short": "0123456",
  "git_remote_status": "clean",
  "build_id": "homologacao-0123456-20260726120000",
  "snapshot_path": "artifacts/releases/homologacao-1234567890abcdef1234567890abcdef",
  "image_repository": "810204249111.dkr.ecr.sa-east-1.amazonaws.com/brana-cloud/backend",
  "image_tag": "release-homologacao-0123456",
  "image_digest": "sha256:0123456789abcdef0123456789abcdef0123456789abcdef0123456789abcdef",
  "image_architecture": "amd64",
  "ecs_cluster": "default",
  "ecs_service": "brana-hml-backend",
  "task_definition_before": "default-brana-hml-backend:15",
  "task_definition_after": "default-brana-hml-backend:16",
  "deployment_id": "ecs-svc/1234567890123456789",
  "target_group_before": "ecs-gateway-tg-e9a92e7d6f31c7aaa",
  "target_group_after": "ecs-gateway-tg-755fef69195f7dbe3",
  "listener_rule": "app.institutobrana.com.br",
  "domain": "app.institutobrana.com.br",
  "migration_version_before": "202607250001",
  "migration_version_after": "202607260001",
  "health_status": "healthy",
  "public_smoke_status": "200",
  "authenticated_smoke_status": "200",
  "authorization_positive_status": "200",
  "authorization_negative_status": "403",
  "rollback_task_definition": null,
  "rollback_image_digest": null,
  "rollback_target_group": null,
  "rollback_result": null,
  "failure_stage": null,
  "failure_reason": null,
  "logs_path": "/aws/ecs/default/brana-hml-backend-f5f1",
  "aws_account": "810204249111",
  "aws_region": "sa-east-1",
  "release_notes": "Fase 3A do contrato formal de release.",
  "dry_run": true,
  "created_by_tool_version": "Brana.Release/1.0.0",
  "updated_at": "2026-07-26T12:00:00.000Z",
  "history": [
    {
      "timestamp": "2026-07-26T12:00:00.000Z",
      "from_state": null,
      "to_state": "CREATED",
      "result": "PENDING",
      "stage": "bootstrap",
      "message": "Release contract created",
      "operator": "tel-admin",
      "evidence": "artifacts/releases/homologacao-1234567890abcdef1234567890abcdef"
    }
  ]
}

